{
  "created_at": "2026-10-05T00:00:00Z",
  "evez": "EVEZ",
  "id": "hello-evez-v1",
  "integrity": {
    "algorithm": "sha256",
    "sha256": "e1026a09576c7dd7be0d680fbb7b4821d49daa1e7d729c46733ccc4cb7e3a7ab"
  },
  "kind": "example",
  "payload": {
    "message": "EVEZ is a file format.",
    "note": "Sealed with the EVEZ v1 reference implementation."
  },
  "state": "PROPOSED",
  "version": 1
}
